{
  "$schema": "./schema/team.schema.json",
  "name": "TALES",
  "tagline": "Mỗi người một chương · Chung một câu chuyện",
  "description": "TALES: năm con người, năm câu chuyện riêng, cùng viết nên một câu chuyện chung.",
  "shuffle": true,
  "members": ["tam", "nhung", "member-3", "member-4", "member-5"]
}
